{"schemaVersion":"causora.contract.v1","dataVersion":"demo-2026.10.04-v4--UNREVIEWED_DEV_ONLY","requestId":"final-dev-evidence","data":{"evidence":{"id":"EV-024","sourceFile":"supplier_a_agreement.pdf","page":4,"quote":"The renewed term has a minimum purchase commitment equal to 60% of forecast demand.","locatorBbox":[54.0,550.711,499.676,565.825],"extractedField":"min_purchase_share_A","extractedValue":"60%","matchMethod":"exact","matchScore":1.0,"quoteMatched":true}}}